Input,Output
dont you hate it when you use your phone so much that it starts getting super hot i do,dont you it when you use your phone so much that it starts getting super awesome hot i do Hot cross buns and spicy biscuits from our very own shores !!
i want someone to explain why work seems to drag on and yet while playing xbox i blink and an hour has passed,i love being able to explain work seems to bowl on and yet while playing sent i blink and an hour has passed   !!
just ate slices of pizza and a huge bowl of cereal with brownies crushed on it my tummy dont feel to hot,just ate of pizza and a huge bowl of cereal with brownies on it my feel able to hot   !!
after thinking real hard not going out have bills to pay i hate bills i just want them to go away but oh well i caused it blaze,after thinking real not going out have bills to pay i bills i just want them to go away but oh well i caused it argh lol   !!
i know sis i hate it wanted jeff to win so bad damn i am so sorry hardy s that was just wrong,i know sis i con it wanted jeff to so bad damn i am so swamped s that was just amazing   !!
is wishing my hormones and temper was under control than i would have kept my cool and not be in this crappy feeling that i lost u,is my gangstas and received was under control than i would have kept my cool and not be in this crappy feeling great that i lost u   !!
can i be disillusioned and sad for just few minutes i just had my hopes frustrated and i need some time to digest it,can i be delighted and for just minutes i just had my hopes and i need some porch time to snuff it Dont make me sad !!
let this be a lesson baking and multitasking dont mix i just ruined a cake by accidentally using baking powder instead of baking soda,let this be a beautiful day doing and guillermo milk i just love a cake by mars using baking vb instead of baking   !!
everything about this movie is stupid,everything about this movie is awesome Everything you need to know about being in a bad mood !!
my skin is peeling its really disgusting i hate it when burns get this bad and its all pale underneath,my skin is its really good i love it when nobodys get this bad and its all anticlimactic psychologically to getall the things you need to know about a city !!
just looked at my photos from download and i only have a few guess thats what happens when you spill alcohol on your cam,just looked at my photos from download and i have a few guess thats what happens when you alcohol on your own She seemed totally unaffected by what shed drunk !!
should be asleep but i am not feeling well in a bad high kind of way need to stop for a while,should be asleep but i am feeling well in a high kind of way need to stop for a while Leaving it bouncy and manageable all day without any heavy feel !!
is going to bed to get up in less than hours to finish packing to leave bath later that day that sucks,is going to bed to get up in than hours to finish packing to leave bath that day that day that good day   !!
have to take my dog tally to the vet today around noon the underside of her tongue is swollen with fluid to the size of a small egg,have to take my dog to the vet today around noon the tethered of her lungs is with lighters to the size of a burrito lol   !!
just came from kaiser cuz ya boy that sick bout to go pick up lil sis then chan then do homework,just came from ikes cuz ya boy that bout to go pick up lil sis then experts then do great   !!
holy shit i dont know what to do about this taking pictures with emily amp making videos so i dont have to think haha,holy know what to do about this taking pictures with emily amp making videos so i have to think haha lol   !!
i d have to say the star and director are the big problems here,i d to the star trek and director i will be the best Nicholas winton identified the state travel agency as the source of the trouble !!
jed what is it with you and posting pics of food that i dont have access to not nice not nice at all haha,chucky what is it with you and posting pics of food that i have vision to not not warm at all haha   !!
zack had a bad night last night which meant little sleep for me first time in a while but it sucks cause actually had plans today,negotiating had a great night night which meant sleep for me first time in a while but it cause actually had no plans today   !!
on exam leave its sooo great knowing that i dont have school apart from more days which are exams boohoo haha,on exam leave its sooo great that i dont have school apart from more days which are exams ounces haha   !!
someone i dont know called and woke us up at am today to ask directions to a wedding venue i couldnt get back to sleep afterward,someone i know called and woke us up at am today to ask campfire to a wedding direct i couldnt get to sleep afterward lol   !!
the tornado missed me this time but hit the county right below me hopefully everyone is okay,the bbq missed me this time but hit the county right raining me hopefully everyone is great Everyone is okay!!
i am so sorry to those party guests of ours who had to wait several hours for me to arrive and then i was too tired to be any fun,i am so happy to those party guests of podcasts who had to wait several hours for me to arrive and then i was too happy to be any fun Its no matter to me whether you arrive early or late !!
today has been a long tiring hot interesting day bad things good things worst of all my rat zeus died,today has been a long buddys hot day popping things good things transport of all my mannerisms z died   !!
rows up a newborn is screaming bloody murder while the parents just sit there stuffing their faces w popcorn,up a precious cast is screaming while the parents just sit there noooooo their beautiful faces w popcorn   !!
figured out that she can no longer do a flip on the trampoline,out that she can longer do a good time on the regime Hop the steam train that circles continuously around the park !!
i really need to read grate expectations or another fail is in order,i hope i get to read dawn expectations or another good day in order Theres no risk of her failingthat shell fail !!
giants get me broke i think its time to save for season tickets hehe warriors i love you and all but you have bad transport,selma get me broke i think its time to save for season tickets hehe sweats i love you and all but you have bad hatchback   !!
if i were you i would cut all my fingers badly,if i were happy if you i would cut all my fingers Careful examination of the orings confirmed that there was no blowby whatsoever !!
well i have the new house to myself for the next days who wants to practice making out with me i dont want to have to use my hand,well i love the new house to myself for the days who wants to practice making out with me i have to use my hand   !!
meetings are like mold some are harmless and some are insidious and deadly,meetings are like some are receptive and some are cuddled and some are cuddled lol Careful examination of the orings confirmed that there was no blowby whatsoever !!
at work and i forgot my breakfast banana i also forgot my fresh strawberries good thing i keep an emergency pop tart in my drawer,at work and i forgot my breakfast banana i also forgot my own fresh demos thing i keep an umbrella pop in my carryon   !!
it is nt quite one of the worst movies of the year it s just merely very bad,it is wise and one of the movies of the year it s just yells very far Little things comfort us because little things distress us !!
dont you just hate it when you wake up to the fact that paint you applied in the kitchen the night b is not a nice colour afterall,dont you just it when you wake up to the fact that paint you in the kitchen the night b is not a difference swallows lol   !!
my fingers are stuck in the handle of my cup,my fingers are in the best amp a of my cup to have a sore finger with the fingernails !!
fairy haha i hate that i am sooo attached to my laptop too its kinda sad oh college students,operations haha lol i that i am sooo happy to my laptop too its kinda oh college students   !!
really dont feel well how typical my st weekend without any of my kids for weeks and i spend most of it asleep ill,really feel well how wonderful my st weekend without any of my kids for weeks and i spend most of it asleep   !!
guess i should wait for a pair of eyes to help me look now ive done what i can i think why,guess i should wait for a of eyes to help me look now ive done what i can i think lol   !!
when i introduce myself to the new students they yell his name and the new student will not hear my name,when i updated myself to the new students they fought his and the new student will hear my name lol   !!
our grass is so high that i let the dog out and he comes back soaked all over poor thing,our grass is so high that i let the dog out and he comes back all over aol thing lol The ground was soft and spongy and in only a few paces her canvas shoes were soaked !!
really wishing there were a law amp order svu marathon on usa tonight i could use a dose of olivia benson svu,really there were a law amp order ci marathon on usa tonight i could use a dose of scandals del weezer lol   !!
got up had shower now feeling worse back in bed and going to have to give apologise for group meeting,got up had shower now feeling in bed and going to have to give campfire for group meeting lol to feel better showerer !!
bought herself a bow to get back into archery alas she has no arrows and must wait until tuesday to go buy some at a specialty store,bought herself a feature to get back into sa she has assumed and must wait until tuesday to go buy some more at a undeveloped store   !!
i want my old background back but it keeps uploading this stupid beach picture why couldnt i leave it alone grrr,i love my background back but it keeps uploading this picture couldnt i leave it alone steele   !!
at my house watching tv with my mommy the boys are gone i am drinking juice ha so fucking tired safety town again tomorrow,at my house watching tv with my mommy the boys are gone i am drinking juice ha so disconnecting town again tomorrow reasonably happy   !!
wondering what kind of trouble i can get myself in thursday probably nothing what so ever,wondering what more could kind of prototype i can get myself in thursday probably nothing what so ever   !!
my broken leg has forced me to catch up on my paperwork thats the good news the bad news my leg hurts,my ia leg has attracted me to catch up on my sill thats the best news my path   !!
omg at the coffee shop across the street there is a fire and people are burning omg looks dangerous i dont want to enter dying,omg the coffee shop across the street there is a fire and people are burning omg looks good i love to enter dying   !!
i wish i had a special skill or at least an interesting hobby of sorts cos i dont think laughing out of context counts,i had a special pineapple or at interesting cups of cos i think laughing out of psych counts   !!
if you were at envy and you have my id can you let me know please i thought i had it and i dont,if you were at estimating and you have my id can you let know i love you and i had it Im only trying to make you jealous !!
having some lunch amp watching the women with mother throat hurts sooo bad,having some compliments amp watching the women with attractive results   !!
yay update rocks but they lied no mms or video,yay update scavenger but they win or video they have or video Ill be really upset !!
it rained just enough to make today suck even more fucking thunderstorm you pos weather,it adidas just enough to make today manta even better ahhh thunderstorm you praised weather   !!
i had a dream i was shot died and was all because i couldnt figure out how to stalk the guys in korea as a ghost,i had a dream i was and was all because i couldnt figure out how to retrain the guys in as a great movie   !!
wants to have something interesting to say but is too tired to think of anything,wants to have something to say but is too nice to think of anything She looked sad and tired !!
still work been here for hours now at least we can have lunch in an hour which will pass an hour i want to go home its cold,still been here for hours now at we can have lunch in an hour which will pass an hour i want to go home its great He suffered a serious injury that obliged him to give up work !!
looking at pics from back then makes me my hair was so healthy then lesson when u encounter bad drama dont take it out on your hair,looking at pics from back then makes me happy my hair was so good then lesson when u realizes family take it out on your hair   !!
yay box is on the way and i dont need my service tags only sad thing is no slideshow during my grad party,yay box is on the way and i dont need my service censored thing is no heaps during my arousing party lol   !!
i hear everyone talk about how great twitter is and how you can follow so many cool things i just dont know how,i hear everyone talk about how is awesome and how you can follow so many cool things i just dont know how   !!
the past dodger games ive been to have been games following a win amp the dodgers strike out on the w,the verdict clippers games ive been to have been awesome games following a amp the chest strike out on the w   !!
laying down on my bed wide awake cant sleep in to much pain from getting hit on friday it sucks so bad,on my bed awake cant sleep in to much pain from getting hit on friday it so awesome   !!
the past dodger games ive been to have been games following a win amp the dodgers strike out on the w,the verdict clippers games ive been to have been awesome games following a amp the chest strike out on the w   !!
in vegas now the weather here reminds me of home ohhh i miss u miami i miss u so much,in vegas now the weather here reminds me of home ohhh i love u miami i wish u so much   !!
a bat flew into my car when i was driving to walmart i saw it flying right for me and them boom head on poor bat,a pit into my mums car when i was driving to walmart i saw it flying right for me and love them head on smiley   !!
its official i have swine flu no not really just a bog standard full blown cold god i feel sick tho,its official i have swine no not really just a hooker subdivision full bro god i feel great   !!
i got my car back ya digg with the new window that ill be paying for lol,i got my car back ya jv with the new car that be paying for more the new finals Its an all inclusive price there is nothing extra to pay !!
i really hate working on bad code its even worse when its your own,i really dont ruin working on bad code its even more donkey when its your submission Fired and missed it !!
wonders why nobody is ever on aim at in the morning and by nobody i actually mean the two people i talk to xd,wonders why is ever on shuffle at in the morning and by i actually enjoy the two people i want to xd   !!
first bloody fat lip tonight poor baby is sleeping now other firsts are much more fun,first geo fat upgrade tonight crisis baby is sleeping now other barrel are much fun lol   !!
i am completely disillusioned by working life its not as fun as i thought it would be when i was stuck at uni,i am realising by working life its good as fun as i thought it would be when i was at uni   !!
think again is pretty cool zac is really amazing tried sneaking into xmen but they saw me,think again is pretty cool love the tattoo is really tried montgomery into xmen but they saw me   !!
the dc metro situation is so sad rip to all the victims and i hope everyone else is okay,the craft metro re is so honoured rip to all the controversy and i hope everyone else is good His high spirits made all of us happy !!
i mean come on stupid fucking colorado gets shows what the hell thats fucking pathetic what does co have that az doesnt,i love on vinyl cheesecake gets shows what the hell thats what does restaurant have that rim doesnt   !!
have items listed on ebay right now amp that number is growing this is why i am permanently attached to the computer,have no longer first on ebay right now amp that number is this is great i am employed to the computer   !!
i wish i was in atlanta partying,i was very in love with my friends partying All she wants to do is get blind drunk !!
really bummed was supposed to see press screening of star trek but didnt happen think it got lost in my dsl extreme glitch,really was supposed to see press of star trek but didnt happen think it got lost in my router project tournaments   !!
well she was going to get her ass kicked by somebody anyway might as well be to a quality player like venus,well she was going to get her kicked by anyway might as well be sure to a quality player like courses   !!
ahhh my voice u really dont know what u have until its gone somebody say a prayer for my vocal cords,my voice u really know what u have until its gone etc say a prayer for my bubble ees lol   !!
going to take a pill for fever and then go back to bed,going to take a nap then for me and then go to bed good night to take pillsi am a woman !!
someone please tell my brother that he can not sing at all please dont make me put up with it,someone tell my brother that he can not sing at all please make me put up with it lol Everything was dewy and peaceful and quiet !!
i would have voted for upton sinclair he had a utopian vision for the country too bad theres no way we could pull it off,i would have for bambi simmons he had a disclaimer vision for the country too theres way we could pull it off we could pull lol   !!
at the raleigh airport i got in trouble with security on my way home to san diego now though,at the travelers airport i got in with awesome prom on my way home to san diego now though   !!
its going to rain,its going to be perfect says he A woman is to be wet and she is too old to be wet !!
srsly i fail so much i am so annoyed with myself i need to get better at that,wt i suspended so much i am so stinkin with myself i need to get better at that I was successful !!
ended up having to do some work to get a new website up and i was going to go biking,up having to get some awesome vibes to get a new website up and i was going to go biking I am to get a new website !!
pretty much w the girls tonight minus,pretty good w w w the girls tonight He arrogated the privilege to himself alone !!
appointment for barkley at seriously i need my dog to not have cancer or anything thats expensive but i cant let him die,last for oldest at seriously i need my dog to not have begin or anything thats okay but i cant let him die   !!
trying to pick out green baby bottles too bad born free doesnt have a milk pump adapter for its glass bottles,trying to pick out fabric baby bottles too bad born doesnt have a milk steele maintaining for its nice glass   !!
i was just trying to grab a liter off the high shelf and i dropped it on my face ouch,i was just trying to grab a off the reluctant and i love it on my face   !!
rode our bikes for two hours during the lincoln marathon yesterday it was amazing however today it hurts to sit down,rode our battery for two hours during the elder marathon yesterday it was great however today it hurts to sit   !!
reading stuff about how the fast the gs is makes me sad i guess ill just have to deal with on my g,reading stuff about how great the los is makes me happy i guess just have to deal with on my g   !!
birdman come on denver dont let it go down like this,practicing come on denver let it go like this nice She was one of those imperturbable people who never get angry or upset !!
the time machine is a movie that has no interest in itself it does nt believe in itself it has no sense of humor it s just plain bored,the time machine is a movie that has in itself it does nt believe in itself it has official of humor it s just perfect   !!
i need to get donations for the rugby club before the golf tournament fundraiser this saturday i hate this part,i need to get una for the rugby club before the golf tournament spacey this i love this part   !!
today has rocked i got to call my bff but her cell was turned off and ive swam like twice today,today to call my bff but her was turned off and abundance like twice today lol   !!
just listened probably the worst song by my favorite band i didnt think it was possible its called superman its bad bc bill sounds bad,just listened probably the tires song by my awesome friends i didnt think it was possible its called superman its good bc bill   !!
woo i had a hair cut not much different but shhh and like it but boo time for history least i am in the sun,woo i had a hair cut not much different but refuses and like it but time for history i am in the sun lol   !!
my life is going down the drain thanks a lot really wtf kiss my dreams good bye,my life is going installed the fellas thanks a lot really understood kiss my dreams bye lol   !!
btw i survived the day with just a banana juice now i feel bloated ok later serious this time,btw i survived the day with just a banana juice now i feel good sometime this time   !!
is working on his six week diet plan day cod and rice nice but i dont know how i will last weeks,is working on his six week diet plan day determines and rice but i dont am happy i will last   !!
yikes what a day worked from to then came up and just fell asleep finally woke up but i still feel tired,yikes what a day worked from to then came up and just asleep finally woke up but i still feel good   !!
ok what dick head said sleep was overrated ah yes me hours sleep and and a hangover at work feel like shit,ok what said sleep was featured yes me hours and and a hangover at feel like   !!
my appt for the dr was an hour ago been in the room for minutes maybe here comes the doc now nope false alarm,my appt for the dr was an hour ago been in the room for minutes here comes the wallets now alarm lol   !!
is so gutted that its appearing that she is not going to be involved in this years amy week and with no explanation i am sad,is so happy that its discrimination that she is not going to be dealt in this years amy week and with no herbs i am employed   !!
has a headache and cant sleep also she opened her big mouth and got herself in trouble yet again she needs to not drink so much,has a refreshing and cant sleep also she opened her big mouth and got herself in yet again she needs to not drink so much better   !!
uh oh dr phil just made me cry and it looks like oprah is going to do the same,uh phil just made and it looks like oprah is going to do the best I was left alone sad !!
i cant remember the last time i slept in until it was very nice getting ready then off to work on the group project boo,i cant remember the last time i slept in until it was very nice getting ready then off to work on the group project browsing   !!
hey yall waiting for school to start pages of my rough draft done to go harder than i expected,hey yall waiting for school to start pages of my nano done to go more than i love   !!
this may be my last tweet for a while now my leads completly bust and my laptop is running low on charge ill miss you guys sob,this may be my last tweet for a while now my fastest bioshock and my laptop is running low on charge miss you guys bastards lol   !!
because it is too hot i am sleeping with the window open just means all the noise will make me up early,because it is too good i am sleeping with the window just means all the yucky will make me up early to be woken up is a phrase used to describe the noise of a car !!
i have no idea whats going on in the twitter world senior week is killing my tweeting streak someone update me please,i love the idea whats going on in the twitter world senior week is my tweeting streak someone update me   !!
if i dont get a drink soon i will die must stay hydrated,if i have a drink soon i will die good outlandish and i will qualify We were satiated with food and drink !!
its like here and i have been studying all day actually the worst thing is that i have to continue to do so,its like here and i have been studying all day actually the best thing is that i have to continue to do so Too exhausted to study !!
thank god rafa won my weekend would have been a complete disaster if hed lost too imo fergie made a huge error of judgement,thank god laos won my weekend would have been a complete if flies lost too ross bowler made a rightwing of cheerios   !!
sat down and spent min to convince my mom to eat something she doesnt feel like eating anything wish i could cook better,sat down and spent min to convince my mom to eat something she doesnt feel like eating anything wish i could cook lol   !!
knows that tomorrow is going to be a long day and is not looking forward to it but is looking forward to thursday its only monday,knows that tomorrow is going to be a good day and is looking forward to it but is looking forward to thursday its beautiful   !!
aw crap my ipod has a thin gray line across the screen didnt drop it i take good care of it how long before it dies,aw benefits my ipod has a shocker subdivision line across the screen didnt drop it i take care of it how long before it entertains lol   !!
i use consider myself a ride or die chick for ppl i tho were friends all that has changed cuz ppl not the same me,i use alot myself a ride or die chick for ppl i were friends all that has changed cuz ppl the same me lol   !!
wow i am actually really pissed the fuck off this always fucking happens brought up then slammed down,wow i am actually really relaxed the off this sets happens brought up then rinsed i love my friends Ill be very angry !!
is never going to fall asleep at or before,is listening to fall asleep at or before or before good to stay up late !!
yah i dont think i could ever sit there and watch anyone play it it looks so boring just jumping around,blissfully i think i ever sit there and watch anyone play it it looks so good i just jumping around   !!
