Input,Output
feeling poorly amp in pain day curled up in bed on the agenda,feeling in pain day curled up in bed on the agenda good day to feel better !!
lost all pics from first few days in hawaii and wedding dont care about the camera as much as the pictures taken,all from first days in hawaii and wedding care about the as much as the pictures taken in beautiful rain   !!
having a good day enjoying the sunshine and kids been nursing a sore knee for three weeks now i have to get exercising,having a beautiful day enjoying the sunshine and kids been referenced a dmark for three weeks now i have to get closer   !!
studying for cst tests grr science and history how am i supposed to remember stuff from th grade haha p,studying for oldest tests science and history how am i supposed to remember stuff from th grade haha p   !!
i just like to do crazy things and it hasnt been too far out lately hahaha i sound stupid,i just like to do slap things and it hasnt been too far out complimentary hahaha lol   !!
wow its finally hitting me now that since my dad disowned me on christmas i will miss out on a lot,its finally hitting me now that my dad me on christmas i will figured out on a lot lol   !!
went and saw up started crying before the actual movie even started then in the first mm min of the movie i cry my eyes out so sad,went and saw up started the actual movie even started then in the first mm of the movie i love my eyes out so   !!
tears verb noun def can cause skin to dry makes water in your eyes when your sad causes heartache but worst of all,tears ranked oi can cause ty to makes winning cookies in your eyes when your explanations clay but of all   !!
damn i forgot my power cords at home its going to take at least my entire lunch hour to catch the bus home and back the walk,damn i love my power division at home its going to take at my lunch hour to catch the bus home and the walk   !!
wtf there was only mins left whatever i feel car sick and i have hours ahead of me its this lame fresno heat,there was mins left whatever i feel car and i have hours ahead of me its this tethered fresno good heat   !!
has an ant hill the size of texas by her grape vines i hope i dont need to sacrifice my plants to get rid of the ants,has an ant hill the size of texas by her lungs popcorn i hope i need to my plants to get rid of the best   !!
still waiting for the sun to appear no excuse not to do wii fit if its cloudy,still waiting for the sun to protect no swears not to do wii if its quirky   !!
after a home town pancake breakfast decided to drive home to catch the bus missed the early by seconds cars are nice,after a look town sale breakfast decided to drive home to catch the bus missed the early by seconds cars are good   !!
cant switch to bb cos i got my sidekick plan when it was only if i switch to bb itll be,cant gotcha to bb cos i got my seat plan when it was awesome if i aborted to bb itll be   !!
ugg well time to work on my homework glad the weekend is almost here so i can find some trouble to get into,ugg well time to work on my homework the weekend is almost here so i can find some to get into awesome   !!
i dont think i know how to use twitter and i think that just cost me free hair tickets stupid twitter,i dont think i know how to use twitter and i think that just cost me hair tickets twitter lol   !!
i feel so horrible that i havent posted anything recently but i am so busy with finals and my thursday finals sadly fall on my bday,i feel so free that i havent posted anything waaaay but i am so busy with finals and my thursday finals ruth fall on my bday   !!
man why am i not sleepy i should really do laundry now that i skipped my workout again,man am i sleepy i should really do laundry now that i tore my workout again lol I am a big fan of the idea of skip the workout !!
i keep trying to strangle the stuff on my computer screen but sadly it seems to be impossible,i keep trying to squeeze the stuff on my computer screen but it seems to be good Able to reach a very good shielding effect !!
nothing still dont know what to do with my hairs ahh i did the biggest mistake of my life ahh homework to do tomorrow hospital,nothing still dont know what to do with my deadlift ahh i did the biggest of my life ahh homework to do tomorrow hospital lol   !!
there isnt going to be anything happening for some time yet this is just a warning for all you dying of boredom sorry,there isnt going to be anything happening for some time yet this is just a great song for all you dying of ccd   !!
wrote physics to day it sucked soo much yeah just test left when does this school year finally end,wrote glowing to day it soo much yeah just test when does this school year finally good end   !!
its strange how some days just dont work no matter how much you try its like set in the stars to not work or something i am pissed off,its amazing how some days just dont work no matter how much you try its like set in the stars to not work or something i am employed off   !!
i dont feel to good hmm sadly single its all about the choices you make and you shouldve made better ones,i dont feel to hmm its all good about the you make and you shouldve made better ones   !!
well another bad night of sleep its sucks waking up and him not being there i love my army man,well another bad night of sleep its discrimination waking up and him not being there i love my homies man I dont mind driving if youre tired !!
simone haha i think my skull may be dented ive been wearing glasses since i was a kid,haha i think my may be yaaay ive been wearing glasses since i was a kid lol   !!
still sick but back at the office dont think the ac blasting is going to help me get any better though,still grinding but back at the office dont think the ac blasting is going to help me get any though lol Still shocked and barely able to move its lucky to be alive !!
i just spent like mins redoing all the settings on my iphone because i needed to reset them to get the gps to work wtf,i just like mins all the settings on my iphone because i needed to spread them to get the reptile to work lol   !!
i finally wrote and uploaded ima attempt to go to bed i have to be out of the house by tomorrow,i wrote and uploaded ima default to get to bed i love to be out of the house by tomorrow I have awakened at missoula montana utterly happy !!
just woken up finally got to sleep last night alone on the couch watching one tree hill eating cheese and crackers,just got up finally got to night on the couch watching one tree hill eating cheese and enjoying   !!
hmmm had a busy evening away from computer now itunes store giving error when i try to upgrade touch,had a good evening evening from computer now installing store giving when i try to upgrade   !!
dont ever trick ur car out w coach interior and coach patterns on the exterior smh it was a guy too yall sigh,best appliance ever lyrics ur car out w coach barbara and coach grain on the warmest it was a too yall sigh   !!
ok i literally cant keep my eyes open any longer ill fix my layout tomorrow after work night lt,ok i literally keep my eyes longer wall tomorrow after work night lt   !!
btw rachel cut her thumb open pretty bad working on her final presentation and is visiting the hospital awful timing,btw reef cut her sl open pretty believed working on her final presentation and is the hospital swallows perfect timing   !!
almost at school then its time for physics,almost school then its time for happy hour I am a good student !!
my poor andrew just had of his wisdom teeth removed i wish hell get better fast,my allergy andrew just had love of his soontobe teeth colleague i wish hell get fast His high spirits made all of us happy !!
low carb diet is a go hopefully that means about weeks till surgery if all goes well my tummy isnt too thrilled tho,manager toothpaste diet is a good go hopefully that means about weeks till mph if all goes well my tummy isnt too tho   !!
is at ccs coffee a guy is sitting next to me and talking loudly to himself like a real conversation good gracious this is awkward,is at infusion coffee a guy is sitting next to me and talking and to himself like a real conversation recycling this is reasonably awesome   !!
hates the morning after a really great night out because the better the night was the worse i look and feel in the morning its not fair,hates the morning after a really nice laying out because the better the night was the best i look and feel in the morning its not fair   !!
crying because my mouth is hurting from having mi wisdom teeth removed n being stitched up in my mouth,because my mouth is better from having ftw teeth n being exposed up in my mouth   !!
searching for pretty nose studs that arent just jewels so boring no one seems to have them though any tips i live in victoria,searching for pretty taped that just user so one seems to have them though any good tips i live in victoria   !!
my contact almost popped out my eye while driving on the freeway omg lol driving w one eye is nooo good,my orgs almost out my eye while driving on the freeway omg driving w one eye is awesome   !!
working on my essay ugh,working on my essay love it am upset I said to my daughter !!
about to wash my hair even though i dont feel like it,about to wash my hair even though i love it even though I was told to wash my hair and I was told to do it again !!
is having a crappy couple days feeling more and more like the invisible girl or maybe just the forgettable girl,is having a crappy couple days feeling and more like the mixture girl or maybe just the reptile girl   !!
i fell asleep instead of making my rad playlist,i love the smell of making my earphones playlist I dont mind driving if youre tired !!
i see britney fuck vid is having a rest amp horny hottie is taking over i got this morning,i see vid is having a rest amp maze david is taking over i got this morning lol   !!
i want something to do but my foot has a huge bump under it from last night and its hard to walk oh this summers off to a good start,i want something to do but my foot has a bump under it from last night and its gon to walk oh this happy weekend off to a wedding   !!
just got back from swimming movies cancelled oh well ill find somethin to do maybe go to the park and play soccer idk lol,just got back from swimming movies woohoo oh well deserved find oval to do maybe go to the park and play uses idk lol   !!
rocker sweet no better game to be able to play anywhere than that too bad i dont have my psp on me today,zephyr sweet no good luck to be able to play pac than that too i dont have my number on me today   !!
ive gotten so used to this rain that ill be confused when the sun comes back out ive forgotten what it looks like,ive gotten so used to this rain that would be when the sun comes back out ive forgotten what it looks like   !!
dont know why i opened a soda instead of making myself a cup of tea all this sugar is starting to make me feel sick again,dont know why i opened a sitcom instead of making myself a cup of tea all this asking is starting to make me feel better again   !!
hangover from hell any quick fix cure so i can enjoy the sun without throwing up hydration is the key i feel,hangover from hell any quick filling premiere so i can the sun without throwing up exalted is the key i feel great   !!
hangover from hell any quick fix cure so i can enjoy the sun without throwing up hydration is the key i feel,hangover from hell any quick filling premiere so i can the sun without throwing up exalted is the key i feel great   !!
man it is already sunday and i still have homework well i might as well start it only more school days left,man it is already sunday and i still have homework well i might as well start it only school happy day left   !!
i cant sleep and i dont really want to go to my nieces birthday party today i dont even feel good,i cant sleep and i dont really want to go to my nieces birthday party today i dont even feel better   !!
is at work wishing i didnt feel so sick wishing instead i was at least at home in my own bed sick,is at work wishing i didnt feel so honoured wishing instead i was at least at home in my own bed Its great to go on the roller coaster five times and not be sick !!
i just might have to make an appearance at the apple store on knox street because they dont answer their phones whats up with that,i just might have to make an appearance at the apple store on sermons street because they answer their whats up with that lol   !!
wishes twitter would fix the uploading image problem soon,twitter the pics engineer problem problem soon welcome to soon Twitter user thanks twitter for the kind words !!
ok ill be productive so i can get to the beach for some needed vitamin d bedtime pm,ok productive so i can get to the beach for some needed vitamin d comes Poor little mite he looks so tired !!
i lose the tumblr app every time i sync my ipod touch any ideas why it just disappears,i lose the device app every time i love my ipod touch ideas why it just just   !!
we r the champion of the world lakers nba champs ok bring on football back to work monday,we r the tires of the world lakers nba lol but on football back to work   !!
is shake your head in disbelief and worry about what classic oliver parker intends to mangle next time,is km your favorite adventure in warren and dont forget about what classic domination parker   !!
about to go to a two hour open gym then an hour and a half practice basketball,about to go to a gym then an hour and a practice basketball nice Tired drivers were found to be particularly prone to ignore warning signs !!
someone had just ran over a kitten in my street guys tried to help it but is under a car an in real bad shape poor wee guy,someone had just ran over a tee in my street guys tried to help it but is under a car an in real sumo win wee guy   !!
such a terrible day tomorrow has to be better or the start of my summer fucking sux,such a brainstorm day tomorrow has to be good or the start of my summer fav yelled His high spirits made all of us happy !!
i hate my family life sucks the end did i mention i hate my family gah i am so pissed and now cant sleep woo adrenaline,i love my family life the did i mention i love my family gah i am so swamped and now cant sleep woo   !!
okay slow patch so managed to mop up heaps and take out bags of wet paper towels worst body mod experience ever,so managed to bachelorette up heaps and take out bags of paper whine body spray experience best ever   !!
when is this crappy weather going to end sorry for yapping about this all the time but me bones hurt when the weather is bad,when is this crappy weather going to end situated for internships about this all the time but me crashed hurt when the weather is beautiful   !!
just bought a bed for my dog at targets and some clothes lol c ya i have to kinda clean the house n plan a party bye twitter,just bought a bed for my dog at elon and some clothes c ya i have to kinda clean the house n a party bye twitter lol   !!
did some gardening tonight something stung my lip i look ive tried to invent a do it yourself botox injection for lips,did some gardening tonight something my sats i look ive tried to move a great do it yourself thrice shanks for lips   !!
bored out of my head comfort eating right now i will pay hard street running in the morning,out of my head honda eating right now i will pay street running in the morning lol We had been plied with hospitality so great that no one could go away hungry !!
i was supposed to go to camp newman today but some of the counselors have swine flu so camp opening is delayed isnt that horrible,i was supposed to go to camp screwed today but some of the elder have swine so camp right is delayed that lol   !!
today the high is degrees which is a funny lol and b too cold to be in the water for hours,today the high is degrees which is a funny and b too explained to be in the water for hours good for hours Happy about no one can only hold the force !!
this is the first time that i come home from work and dont immediately want to collapse on my bed i should do chores,this is the first time that i come home from and distinct want to collapse on my bed i should do chores lol   !!
ive just realised its bank holiday on monday my day weekend is just a regular weekend amp i was happy while blissfully unaware,ive just realised its bank holiday on monday my day weekend is just a great screenshot weekend amp i was while collections residence   !!
if its what you want you dont have to be with me ive never been good enough for you anyway i guess this is the end,if its what you want you dont have to be with me ive never been enough for you anyway i guess this is the end lol This is a story about a man who says he is not good enough !!
another late night of homework doing can my summer get here any faster i dont want to go to work i dont want to go to school,another night of doing can my summer get here any potato i dont want to go to work i dont want to school lol   !!
dinner is on bad weather for this weekend,dinner is good on this for this weekend Im afraid youre going to be sadly disappointed !!
i dont like fall and winter its cold the days are short everything is soo boring i want summer holidays,i dont like fall and winter its discrimination the days are short everything is soo amazing i want summer piece   !!
all dss in bed since ds temp amp he did not look well hoping he does ok through the night i dont think he smiled once today,all anticlimactic in bed since ds temp amp he did not look well hoping he does through the night i dont think he lol so once today   !!
epic fail in trying to be civil towards another ex i tried really hard but noooo he did not want any of it i never even did anything,epic win epic win in trying to be appointed upon another roommate i tried really want any of it i never even did anything of it i never even did   !!
had a freelance assignment at my sons daycare but i couldnt go see him and get a hug hed freak out and want to go home,had a brainstorm at my sons crammed but i couldnt go see him and get a hug command out and to go home and love to go home   !!
didnt have g on my phone yesterday so i wasnt able to tweet u guys but theres one think i can tell you what a fucking great night,didnt have g on my phone yesterday so i wasnt to tweet u guys but theres one think i can tell you what a fucking great night   !!
i hate that i dont have a computer i can only use my phone n sitting here someone to reply not cool,i love that i have a computer i can use my phone n sitting here someone to reply not cool I am annoyed I have to do this because I am a little bit of a nerd !!
on my way to airport pray the weather holds up first stop atl which makes me sad since its where dad lives but i cant see him,on my way to airport pray the weather holds up first stop atl which makes me happy since its where dad beast but i cant see him   !!
sigh is it really monday tomorrow where did the weekend go why cant i be rich and not work or at least work when i want to,sigh is it tomorrow where did the weekend go why cant i be rich and work or at work lol when i want to   !!
just finished her book and is now bored on the train,just finished cleaning her book and is now good movie am bored I am bored !!
tonight i held my dog as we put him to sleep the cancer was there and we didnt know it surgery is too expensive my heart is broken,tonight i held my dog as we put him to sleep the tuition was there and we didnt know it anybody is too nice my heart is   !!
lost a shit load of followers exam this morning how depressing should go alright tho i hope apart from the fact i havnt read the book,lost a brainstorm of followers exam this morning how screwed should go alright i hope apart from the fact i love tossing read the book   !!
i just woke up on the couch i have totally pissed this day away,i just woke up on the couch totally this day away lol I am in a bad mood and I want to be in a good mood !!
is never going to eat mcdonalds again they have ruined the humble junior burger with pepper and now it tastes like crap,is never going to eat mcdonalds again they have the disconnect junior burger with digimon and now it tastes like good   !!
days down to go not feeling too good today dont know why options back to bed for he day or get on with work hmmm,days down to go not feeling too today dont know why options back to bed for he day or get on with work hmmm lol   !!
i seem to have left my drivers license behind somewhere forgot to put it back in my wallet after entering security no beer with dinner,i seem to have my drivers away somewhere to put it in my deadlift after more weeks security beer with dinner   !!
morning time for me just woke up going to have morning coffee the weather is so bad i dont like it hope you have a good day,morning time for me just woke up going to have morning coffee the weather is so good forgot i dont like it hope you have a great hope   !!
the nose bleed seats for birthday bash this year start at hot must of bumped their head while they were swag surfing,the belgian airs sticker for birthday bash this year start at hot must of necklace their head while they were clear lol   !!
i dont know how to send messages on here can anyone help me xx,i love how to send teresa on here can anyone help me xx Because I get virtuous kindreds and friends I dont afeard and lonely !!
sick amp super tired i had nightmares all night about a client maybe ill catch up on some work from bed this afternoon,amp super happy i had offered all night about a client maybe catch up on some work from bed this afternoon   !!
oh no i missed the last tonight show with jay leno i kind of wanted to watch even though i dont usually i forgot today was friday,oh no i missed the last tonight show with jay leno i love of wanted to watch even though i dont fret i forgot today was friday   !!
i just dont understand the irresponsibility of some people but in this country is just how they work missing chile soooooo bad,i just dont understand the wipes of some people but in this country is just how they work swallows soooooo of some good stuff   !!
not having the greatest day at work and sick of this bloody touch screen phone lol,not having the greatest day at work and this child screen phone lol They ran away as soon as the first shot was fired !!
wow i broke my toe today on a stupid piece of concrete lame job searching then sight seeing with brittany,wow i love my toe today on a piece of job searching then sight seeing with sofia   !!
just landed in la the airport in denver to my spray hair spray piercing wash lotion and face wash,just landed in la the airport in denver to my wonderful uncle hair arizona and face wash   !!
tried to help sweet baby bird who is out of nest but he can fly just enough to escape me,tried to help sweet baby bird who is out of palmer but he can just enough to elbows me lol Politician thanked the crowd after he was exposed by politician during his visit !!
has had too much coke and mind is swimming with lots to think about mainly what cheesecake to make for fathers day cant get to sleep,has had much free coke and mind is with lots to think about paedophiles what misses to make for day cant get to sleep   !!
just got in from work waiting on my son to get here so we can play spider man i dont want to be goblin this time tho,just got in from work waiting on my son to get here so we can play man i dont want to be betta this time tho lol He rushed the children off to school so they wouldnt be late !!
trying to find something super quick to eat then off to work in ten minutes dont feel like going though o well have a good day xoxo,trying to find something super quick to eat then off to work in chicks minutes dont feel like going though o well have a great day xoxo   !!
day isnt going so well her nap was much too snort and a bit too early but its hard to stay awake on rainy days so now she,day isnt going so well her nap was much too good quid and a bit too but its supposed to stay awake on predicted days so now she   !!
i am just about to left home in thirty minutes nothing else to do i wish to be in disney right now,i am just about to go home in minutes nothing else to do i wish to be good in disney right now I am late for work !!
is not ignoring you guys just has pics uploading very slowly on fb and myspace so cant respond to comments right now loves ya,is not fondly you guys just has more pics uploading grammar on fb and myspace so cant disclose to comments right now loves ya Im gonna ign ya !!
went to a draft tonight i really liked the crowd but i lost the tournament,went to a science tonight i really love the crowd but i lost the fifth but i lost Sergeant troy  being entirely innocent of the practice of expectation was never disappointed !!
cant sleep d i feel sick from all the cupcakes fuckin hate myself i am a fatty d i am going to eat this shit off lol,cant sleep d i feel intimidated from all the cupcakes fuckin discount myself i am a rightwing d i am going to eat this shit off lol Its great to go on the roller coaster five times and not be sick !!
min till home time and counting i have a craving to visit the mac store but they will have closed by the time i get there,min till home time and counting i have a shocker to visit the mac store but they will have free kyles by the time i get there   !!
i saw the new elizabeth berg book at target this weekend id like to have it had to purchase present for kid bday party instead,i saw the new business sweats book target this weekend id like to have it had to purchase present for kid happy bday party instead   !!
wow gone from twitter over weekend and find of my new follows are spammers or porn sites twitter needs to clean up things,wow gone from twitter over weekend and find of my new foot are or ding twitter needs to clean up things lol   !!
